{
  "$schema": "http://json-schema.org/draft-07/schema#",
  "type": "object",
  "properties": {
    "slug": {
      "type": "string",
      "pattern": "^[a-z0-9]+(-[a-z0-9]+)*$",
      "description": "Stable kebab-case identifier of the NPC."
    },
    "name": {
      "type": "string",
      "minLength": 1,
      "description": "Human-readable NPC name."
    },
    "game": {
      "type": "string",
      "pattern": "^[a-z0-9]+(-[a-z0-9]+)*$",
      "description": "Folder slug of the game this NPC belongs to."
    },
    "description": {
      "type": "string",
      "minLength": 1,
      "description": "Plain-text presentation of the NPC."
    },
    "tags": {
      "description": "Free-form tags attached to the NPC.",
      "type": "array",
      "items": {
        "type": "string",
        "minLength": 1
      }
    },
    "attributes": {
      "description": "Values keyed by the game's NPC attributes.",
      "type": "object",
      "propertyNames": {
        "type": "string"
      },
      "additionalProperties": {
        "anyOf": [
          {
            "type": "string"
          },
          {
            "type": "number",
            "minimum": -2147483648,
            "maximum": 2147483647
          },
          {
            "type": "boolean"
          },
          {
            "type": "array",
            "items": {
              "type": "string",
              "minLength": 1
            }
          }
        ]
      }
    },
    "moves": {
      "type": "array",
      "items": {
        "anyOf": [
          {
            "type": "object",
            "properties": {
              "ref": {
                "type": "string",
                "pattern": "^[a-z0-9]+(-[a-z0-9]+)*$",
                "description": "Slug of a standalone move in the same game."
              }
            },
            "required": [
              "ref"
            ],
            "additionalProperties": false,
            "description": "Reference to a standalone move."
          },
          {
            "type": "object",
            "properties": {
              "name": {
                "type": "string",
                "minLength": 1,
                "description": "Human-readable move name."
              },
              "moveType": {
                "type": "string",
                "minLength": 1,
                "description": "Key declared in the game's move type vocabulary."
              },
              "audience": {
                "description": "Optional audience that owns this move; MC moves use `mc`.",
                "type": "string",
                "enum": [
                  "character",
                  "npc",
                  "mc"
                ]
              },
              "playbook": {
                "description": "Playbook slug when the move belongs to one.",
                "type": "string",
                "pattern": "^[a-z0-9]+(-[a-z0-9]+)*$"
              },
              "description": {
                "type": "string",
                "minLength": 1,
                "description": "Plain-text explanation of the move."
              },
              "trigger": {
                "description": "Situation that triggers the move.",
                "type": "string",
                "minLength": 1
              },
              "roll": {
                "description": "Optional roll configuration.",
                "type": "object",
                "properties": {
                  "rollType": {
                    "type": "string",
                    "minLength": 1,
                    "description": "Game stat key, `formula`, or `none` describing how the move rolls."
                  },
                  "rollFormula": {
                    "description": "Explicit roll formula when rollType is `formula`.",
                    "type": "string",
                    "minLength": 1
                  },
                  "rollMod": {
                    "description": "Signed 32-bit modifier added to the roll.",
                    "type": "integer",
                    "minimum": -2147483648,
                    "maximum": 2147483647
                  }
                },
                "required": [
                  "rollType"
                ],
                "additionalProperties": false
              },
              "results": {
                "description": "Outcome entries keyed by the game's roll result vocabulary.",
                "type": "object",
                "propertyNames": {
                  "type": "string"
                },
                "additionalProperties": {
                  "type": "object",
                  "properties": {
                    "label": {
                      "type": "string",
                      "minLength": 1,
                      "description": "Human-readable label for this result tier."
                    },
                    "text": {
                      "type": "string",
                      "minLength": 1,
                      "description": "Plain-text outcome for this result tier."
                    }
                  },
                  "required": [
                    "label",
                    "text"
                  ],
                  "additionalProperties": false,
                  "description": "One possible outcome of a move roll."
                }
              },
              "uses": {
                "description": "Available uses, stored as an unsigned 32-bit count.",
                "type": "integer",
                "minimum": 0,
                "maximum": 2147483647
              },
              "choices": {
                "description": "Choice instructions attached to the move.",
                "type": "string",
                "minLength": 1
              },
              "tags": {
                "description": "Free-form tags attached to the move.",
                "type": "array",
                "items": {
                  "type": "string",
                  "minLength": 1
                }
              }
            },
            "required": [
              "name",
              "moveType",
              "description"
            ],
            "additionalProperties": false
          }
        ],
        "description": "A move reference or a complete inline move."
      },
      "description": "Moves cited by slug or written inline for this NPC."
    },
    "drive": {
      "description": "Drive, impulse, or agenda guiding the NPC.",
      "type": "string",
      "minLength": 1
    }
  },
  "required": [
    "slug",
    "name",
    "game",
    "description",
    "moves"
  ],
  "additionalProperties": false,
  "title": "PbtA NPC",
  "description": "Portable representation of a Powered by the Apocalypse non-player character.",
  "$id": "https://raw.githubusercontent.com/RebelliousSmile/schema-pbta/v13.0.0/schemas/v13/masks/npc.schema.json"
}